comment,language,product,reviewer,reviewer_review_count,time,title,vote
"They make computers that last for about 1-2 years. After that they start to have issues. After a year and a half with no issues on my computer I had to return it to MSI to be fixed. It took them an entire month to get my computer back to me, which is just terrible. When I tried contacting their support they were some of the most rude people I ever met. So if all you care about is a good computer then this is a good company. I feel that there is more to a company than that though.",english,msi,Jonathan,2,2018-07-26T18:21:38.000+00:00,Decent Computers.... Terrible Service,2
"Waited a year for a GT72 2QE laptop to be repaired, it never was, they withheld it from me for months, offered a replacement GT72 6QE, had exactly same fault, wouldn't repair it as I withheld old model from them for same amount of months they did to me. They got it back now, but 12 months later still no £1400 laptop. Cowboys, especially that rude Michael in their UK support, Poland. Avoid the company.",english,msi,HiggitGamer,1,2018-07-08T19:30:52.000+00:00,Waited a year for a GT72 2QE laptop to…,1
I bought an MSI PX60 2QD Prestige laptop in 2015.  The motherboard failed in 2018.  MSI support informed me that they no longer provide support or parts for this 3 year old model.   I will NOT EVER buy another msi product.  Lenovo Thinkpad p50 and p70 series laptops or any of Lenovo future workstation class laptops will be my ONLY options from now on.  Lenovo has 5 year warranties available.,english,msi,Jay,1,2018-07-08T19:34:21.000+00:00,I bought an MSI PX60 2QD Prestige…,1
No way to find the drivers and utilities for an upgraded Win 10 system or even the old ones for windows 8.1 or windows 7. All the download links for legacy machines are no longer available. In my case I'm looking for the latest drivers and utilities for MSI GT70-0NC US. MSI has the worst support site in the industry.,english,msi,fggIB,1,2018-07-01T05:57:56.000+00:00,MSI GT70 Support non existent,1
"I purchased what I thought was a top class Gaming GT72 VR 13 months ago.  Within 6 months there were multiple problems with the system, crashes, lags and random restarts. MSI’s policy on repair is poor and it consists of the item being shipped away for a period of time with the usual threats of bills if it is user error! My laptop was finally repaired after spending three weeks at D and J Henry but went faulty within days. (The laptop had many major parts replaced during repair).  Within two weeks the fault returned and was again repaired, with a motherboard replaced,  Usual wait, slow turnaround.  When it was again returned the repair lasted 48 hours.   MSI now want to send the laptop to Europe for assessment but can’t understand my frustration at something that has been broken for nearly seven months and cost nearly 2000 pounds Damage in transit alone is not a great idea. Like I have said I have a useless piece of kit that I have tried to get repaired and now want replaced but apparently MSI are stock taking and can’t help for the last two days. My advice would be to stay away from this company and choose one which care about after sales and not the margin regarding profits.. Laptop finally replaced with a new one, so that definitely helps, just took so long getting there.",english,msi,Mark Hepworth,5,2018-06-06T04:06:12.000+00:00,I purchased what I thought was a top…,1
"Owner  of a GS73 VR 7RG  purchased in France in october 2017 but living in Brazil. After barely 4 month of use the fan started doing an unberable rattling noise.  I got in touch with their online support a 1st time, and here is what they told me:    ""Dear Customer,  To have your unit repaired at our service center in São Paulo, you'll need to provide them with the invoice you received with your purchase. Please note that the order confirmation doesn’t count as a valid proof of purchase. If you don’t have the invoice, then please get in touch with your store or e-tailer to obtain a copy.  Best regards, MSI ""  Following I got in touch in  São Paulo Service Center who responded me it was impossible for themhelp me solve my Laptop problem since they are not part MSI  global warranty program.  I contacted then a second time MSI support who repeated me the same bullshitty message. I explained them it was impossible to have my laptop fixed in Brazil  since they didn't grant the local service center and that  it would be absurd to send per DHL or UPS (at my own cost of course) my laptop to have it repaired in other country for Fan issues especially because my laptop could in this case stay abroad for long weeks.  MSI support stopped answering me after this message. Simply inacceptable  for an almost 3000€ laptop",english,msi,Cécilio Ola,1,2018-05-09T22:06:56.000+00:00,Low quality product-worspt support ever,1
First off. I bought a laptop (1400$) 3 years waranty. Exact a week afther the waranty ends my pc randomly fell out when I was watching YouTube. I sended my pc to Poland for repair. And im waiting and waiting for the price i would tought oh motherboard okay. maximum of 300... Then about 4 weeks later they send a invoice of 780+ for a repair for a motherboard and a battery. Ok ok. im not going to pay that much.  So i called the support multiple times and when I finaly had someone that wanted to help me he told me he could offer me a (Refurbished or laptop that was deliverd in a wrong collor for so so so so so much less the price then the repair price. They send a invoice of 680 without BTW. I said that's so much then they mailed back ''Uhm yes we can't repair your old laptop anymore). Basicly they wanted to let me pay for a new one. Realy sad.  - Support. - Comminication.,english,msi,David P.,1,2018-05-09T22:19:32.000+00:00,Msi Customer service,1
"Just absolutly garbage. I bought my MSI steel series notebook and loved it to death. Until one day the fans stopped working (oh and right after the warranty expired too.) So i took it to idk how many shops to get it looked at, I called them first and me living in Maui, they said they can't use a p.o. box and that's all I have. So anyway back to the fans. I finally find a shop to look at it and then a week and a half goes by. Guess whats the problem.....the motherboard is. On top of the 150 dollars I spent having it looked at I now gotta pay msi 70 dollars along with shipping and handling and then the cost to get a new mother board in! Yeah stay the hell away from msi its not worth your time.",english,msi,Steven Smith,1,2018-04-25T13:51:28.000+00:00,Just absolutly garbage,1
"I bought MSI GeForce GTX 1050 Ti DirectX 12 GTX 1050 TI 4GT LP from newegg.ca and owned the product for 15 months. Recently one fan started making some noise. After PC case disassembly, I discovered that one fan failed and did not rotate smoothly and ultimately had to be replaced.  I applied to MSI Australia (as I temporarily live here) and here is what their guy (Wayne (no last name)) replied: 1.	MSI treats pc components like cars: they do not warrant products brought from overseas, however, there were no difference in product produced for Australian or for North American markets. 2.	They cannot fix broken fan even if I am willing to pay for it. Cannot they also ship me a replacement OEM fan for my money, so I cannot fix it by myself. Conclusion: card is unfix-able. 3.	MSI Australia recommended to go back to North America and ask them to fix it. OK, fine, MSI Australia ultimately says to throw $200+ graphic card away due to failure of $5-$10 cooling fan. Let’s see what MSI Canada says. Here is what they replied: 1.	North American warranty service advised to go online, where I was requested to agree to receive the replacement product on valid address in USA or Canada. In different words I have to buy return ticket back to Vancouver, BC for $1600 or so, just because MSI cannot enter Australian address on a shipment package.  (Jesus Christ!)  2.	Further correspondence with North American service department was not fruitful. The guy (Kien Hoang) recommended to apply to MSI Australia, which I already dealt with.  3.	The response to my question to send replacement fans for my money and disregard the warranty, also did not result positively. The guy stated the MSI North America does not have cooling fans for VGA cards.  Ultimately, MSI North America also says to throw $200+ graphic card away due to failure of $5-$10 cooling fan.  So, think twice before buying MSI. Obviously, it fails like any other brand. The service though is one complete non-sense. They will do everything possible to screw you and not to fix (even for your own money) the defective product. I have the entire e-mail conversation chain to prove it. Legally, as per policies they developed for themselves they are right, but in physical reality it is a travesty.  Therefore, I DO NOT recommend purchasing MSI. That was the 1st time I got MSI and hopefully the last one. It appeared to be a disposable product that lasted 15 months, for which MSI refused to take responsibility, covering themselves with policies developed by them for themselves, even if you are willing to pay for simple replacement parts like fan.  Regards, Konst.",english,msi,Konst Popov,1,2018-07-10T10:31:05.000+00:00,"…unless you stay home, go get new one if the one you have fails: not repairable!",1
"Absolutely pathetic the way these people handle (or don't handle) support issues! Their product quality is extremely bad now, too, which is more in need of solid support! It seems they are throwing machines together without proper testing and have gotten a terrible batch of keyboards. This has been going on for over a year in forum but no one to reply. The only option is for them to ""Shotgun"" the problem by replacing the keyboard, presumably with the same bad ones because people are screaming that they get their machines back and 2 weeks later the problem is back again! The majority of PCs they make will have some keyboard issue within the first 6 months of use, THE MAJORITY! They don't have any answer or solution, though this appears to be a top issue, and no local repair. So, you have to bounce your machine back and forth across the country and get it back without the problem solved. Their support ticket system is horrendous in itself! They dump put way too many detailed options that you are supposed to select from under each pull down tab as you fill out sections to the trouble ticket. There are some OLD machine part numbers and some 200 other options to sift through for each option, and you are supposed to read each one and select one that matches your trouble, your machine, your motherboard and about 20 other options where literally NONE of the choices match. This looks like a kindergarten operation when you see this and suddenly you begin to understand where underlying problems are in the company! THEY ARE EVERYWHERE!!! This is the case with the entire ticket system, and a 12-year old could instigate a better system or just clean this one up to make it more usable and not more aggravating!! It's been this way for years and no one bothers to fix it, so you get the mentality of how they deal with ALL problems and whyt they aren't being fixed either! It looks like an operation that is working out of their GARAGE!! The login knows all of this detailed information about your machine already because you registered your machine and it shows all these detailed options. But, the trouble ticket has none of these options to select and not well integrated with the website. There is not even an ""Other"" or ""Not listed"" choice, and no way to auto-fill the options. It's the most ridiculous I've seen, that they would even show this to customers and ask them to use this? It's misdirected, broken, and doesn't speak well for the company! I would be embarrassed! Further, almost everything else on the website auto-fills this information or gives you options to select which machine you have registered with them. But, not in the most important instance, like trouble tickets. The forum is laughable, too! There is never an MSI rep to answer or provide help, they never even look at the forum, so you just have people with problems, some for over a year, complaining to each other, some with ""try this and try that"", and no real help from MSI, ever! The biggest issue are basic keyboard problems and keys not working. People have indicated that the keys work on Linux OS, but not windows, so it would say possible software issue, maybe the BIOS, a Driver or other software settings issue. The only thing MSI is doing for these problems, according to numerous recent forum complaints, is asking you to send the machine to them, MSI shotguns the problem by replacing the keyboard, and you get your machine back that still has the problem and the 5 weeks you were without your machine has done NOTHING to fix the problem! Nothing can be more aggravating and losing customers faster than this! I want to fly out there and wring their scrawny necks for lying to me, promising a supervisor will call me back, and never getting the courtesy of a returned call after telling me they will call or look into the problem. This is just a small taste of the general B.S. they impose on customers. They don't realize they are destroying their customer base and repeat customers! They instead hide from customer problems and provide canned responses that don't help. Obviously, they are throwing machines together so quickly without proper testing and they have some major Keyboard problems with every model! People on the forum are complaining about getting the same problem back after sending their machine in, bouncing it across the country and back, and 2 weeks later they have the same problem! This will be my first and last MSI laptop! Pathetic is the best way to describe them and the best they can do, and they don't seem to care either way! This is unacceptable behavior from you, MSI! The rest of us do care, particular with the price we pay to have what should be a better machine and reasonable support! You did this to yourself! Rest in peace MSI!",english,msi,Paul Lewis,2,2018-04-22T07:59:41.000+00:00,Absolutely pathetic the way they (don't) handle Problems!,1
"After a few emails, MSI sent me an operating vid card. I was harsh on them before but they came through.",english,msi,Ray Sarnowski,2,2018-04-20T12:41:28.000+00:00,After a few emails,4
"To be honest, I hate their support. Sometimes I wonder if they got an education within service and sale, or just hire people ""who know much about the gaming industry"".  I had a problem with updating the BIOS (didn't know how to update bios), so I asked the support, and a week later, I got an email where they just redirected me to the driver page. I later found out there was a mini-instruction there, but did they tell me there was a instruction there? No.  I followed the instruction, and on the last part, I had trouble flashing the file. So I asked the support at again, and waited in many weeks. I wondered why I didn't get any answers, so I checked my support history on MSI Support page, and found out they had deleted my support ticket. They get two stars just because my MSI Nightblade I purchased was incredible.",english,msi,Daniel Michael,1,2018-04-10T20:31:40.000+00:00,Garbage support!,2
"Just awful, laptop develops fault after one month. They take a month to repair and within a day the same problem happens again. AVOID AT ALL COSTS. Cheaper laptops have had for years and no problems. Go for an expensive one and just awful.  Thankfully AO intervened and have sent back and exchanged for an HP. If you love hassle and bad service buy an MSI.",english,msi,Jan Gourd,5,2018-04-09T23:39:18.000+00:00,Just awful,1
"Customer service does respond to your problem but it is not very helpful. First off, I bought a notebook which, I later found out, suffers (as many MSI notebooks do) from their cheap fans. after a couple of months both my fans are very loud and rattle all over the place and so I thought: ""fudge, 1300 EUR down the drain, but maybe I replace the heat sink (because you can't just replace the cheap fans, no, you have tro replace the entire heatsink which will cost over a hundred 100 EUR). anyways, contacting MSI to ask where the hell can I get the proper heatsink gets you provided with a link  to a side which seems to be not updated since 2009 and surprise, no matching heatsink. thanks for nothing. Oh, and did I mention the first question from MSI support after describing my problem was ""did you update your BIOS?"" this may work with people who have no clue about the hardware they're using, but this is an insult and a shady business practice for they KNOW exactly what faulty products they ship. well, I guess lesson learnend. I recommend to AVOID MSI if you're not pooping money out of your buttocks. and of course I don't send my notebook to Poland or some country far a f-ing away to just get the same worthless fans replaced again as so many people told that this took place.",english,msi,Ursula Beutelhuber,1,2018-04-09T18:27:01.000+00:00,better spend your money elswhere,1
Appalling customer support. Will stay clear of MSI in the future.,english,msi,Glenn Faulkner,7,2018-04-04T17:42:13.000+00:00,Appalling customer support.,1
"Has anyone EVER managed to register a product with them for warranty? I doubt it. An hour of hunting down random serial numbers from random locations as well as uploading a receipt then reformatting said receipt to finally get a red dragon and an exclamation mark, no idea what that means but i assume not good. Go to old fashioned mail the card inside the box? Guess what? You need the retailer to stamp the card! The ONLINE RETAILER! Clearly a way of scamming your way out of warranty which begs the question, why would you need to unless your products are poor quality.",english,msi,John Maguire,3,2018-04-01T20:19:51.000+00:00,Has anyone EVER managed to register a …,1
"Worst customer service out there. I’ve had numerous problems in the past with their “All-In-One” PCs and, of course, they do fix it, but they expect you to wait at least a month before they do anything. I once tried to replace the front and top bezel of my PC, and they told me I had to wait 4-8 weeks to buy me the parts alone, or pay $190 to fix it over there. Tried to talk to supervisor “Barneby” about the problem, and he said there’s nothing he could do. What a greedy and incompetent company.",english,msi,Never Forgotten,1,2017-10-31T18:04:26.000+00:00,Worst customer service out there,1
"MSI makes great motherboards, bought a MSI 970 motherboard and i can't complain. $100 well spent!! best motherboard I ever used",english,msi,Avery,1,2017-09-14T21:22:10.000+00:00,Great Motherboards,5
"Loved the product, but when it broke down I sought for ways to get help and the tech support required a ridiculous amount of information. I couldn't even register my product to be able to ask a question about how to make it work because I didn't have an invoice for it.   I just want help getting my laptop to start up again...",english,msi,Stephen Green,1,2017-09-05T20:28:24.000+00:00,Loved the product BUT CS SUCKS!,2
"My MSI Z170A Motherboard kept clocking my CPU (i7 6700K) at 800MHz. I tried a number of fixes (Over clocking, updating BIOS, setting Slow_Mo switch on/off, using Intel software, CPUz and so on) and nothing really worked. I called tech support and described the situation. I told the rep that I could not get 4.0 Gigahertz. I must have pronounced it wrong because he asked me “what is a giggahertz? Never herd of that! You mean Gigahertz?” He told me about the slow_mo switch, when I had already meantioned. He told flat out to just RMA the motherboard and be done with it. I hung up, changed more settings on the Overclock options, and finally got it to work (Set CPU ratio at 40, CPU clock 40, turned speedstep off, set the voltage to Fixed and applied all this to 2 out of 4 cores. When I had used all 4 cores the CPU was at 100% usage all the time). MSI has some sassy little snots working for them. I’m not buying their products again.",english,msi,Thoraya Zedan,1,2017-07-07T00:00:08.000+00:00,MSI Z170A Motherboard 800MHz,2
"Second faulty graphics card in a year, first one got replaced by amazon. Tried to contact msi and sent 3 emails to their support centre with no reply. Amazon have now refunded the item as I've had no luck with msi. Avoid unless you want faulty equipment and No support. Great customer service from Amazon is the only saving grace to this situation.",english,msi,Rob,1,2017-07-02T16:10:54.000+00:00,Second faulty graphics card in a year,1
I've had four different MSI products over the years and have recommended way more to friends and family and never had a problem! MSI makes perfect quality products that are unparalleled. Most cases where I here people are having issues are the ones who improperly build and install the products they buy.,english,msi,Zachary Neal,8,2017-06-27T12:51:22.000+00:00,Don't Listen to the Haters!,5
Finally a company that is geared around the user! I bought a gaming motherboard and graphics card from MSI (off of amazon BTW) and the computer I'm using right now is that same computer(just for perspective.) I had no reason to contact costumer support because the instructions were so clear!  One thing that would be nice thought is if they gave the drivers to you on a USB but its my fault my DVD/CD drive doesn't work,english,msi,Ethan Goodridge,3,2017-05-04T15:42:18.000+00:00,MONUMENTALLY GREAT !!!,5
I bought a msi gtx 1060 when went to register it for the free game I got the seasons pass instead even though their sight says if you buy a gtx 1060 you recieve ghostly recon wildlands for free,english,msi,Adrian Dubicki,1,2017-04-30T14:11:38.000+00:00,I bought a msi gtx 1060 when went to …,1
"ABSOLUTELY the worst company I have ever had the misfortune to deal with! Been on this planet coming up half a century and I've never come across a poorer service, be mindful of any promotion with MSI with regards to free game with graphics card purchase, promotional offer also involves NVIDIA and UBISOFT coming up 4 weeks of being sent backwards and forwards MSI advisors who laugh at you openly on a call, no UK customer service advisors to talk to over the phone with only a recorded message that cuts you off after playing for the graphics card option and only advisors who will pick up the phone for notebook lines which is not department you want! It is obvious once you've spent your hard earned money on an MSI Graphics Card they are not interested! It's obvious that the promotion is only there to persuade you to purchase but then company will go around the houses to honor it the fact that I've received the season pass part of offer and not the game code shows its clearly eligible! Spend over £700 after offer of game deciding factor baring in mind most competitors cards ie, Asus in similar brackets price range wise and they stiff you over a game code which to them retail would be minimal cost!, quite convenient no UK customer service advisor to deal with especially in regard to UK sales of goods rules! Quite convenient! Wish I could post all the emails to this site think everyone should be warned about this company",english,msi,Andre Daniels,5,2017-03-24T12:39:03.000+00:00,Stay clear of MSI!,1
"MSI will use cheap components for the keyboard on their gaming notebooks and claim ""excessive use"" and attempt to charge you about 1/5th of the laptop price to ""repair it"" citing out of warranty means.  Screw them.  BUYER BEWARE!  Go with Sager or ANYONE else.",english,msi,Scott Rector,3,2017-02-15T05:37:54.000+00:00,"Uses cheap chassis components, charges you while in warranty to repair them",1
Build a decent PC!!! this is not acceptable.. 1 year in use... and boom cant even play BFBC2 anymore... it took BF4 at first Low- Mid settings. now it's just a brick... and it gets hot when doing basic tasks. like browsing youtube..  No help from the support. no bios update to maybe fix the problem... no nothing....  GE70-2OE   Dont buy!,english,msi,Kasper,2,2016-06-14T19:52:04.000+00:00,Laptop 8000 DKK sudden performance loss,1
Hello.   When will the H170M PRO-VDH be able to go into standby and wake up again ?,english,msi,Peter,2,2016-05-18T16:02:48.000+00:00,Standby problem,1
Ordered a brand new laptop for my girlfriend as a Christmas present. It arrived but it wouldn't boot up. We contacted their tech support and they told us to try the f3 reboot method but it didn't work also. After telling them this they told us to contact their local service centre but did not give us any contact details.  What a bunch of amateurs....  I wish I had just stuck with Apple who build top-quality products AND have the best after-sales support service (along with John Lewis),english,msi,Paulo,1,2015-12-25T14:01:05.000+00:00,UK MSI - If I could give them 0 stars I would,1
